{
  "evidence_id": "660e8400-e29b-41d4-a716-446655440001",
  "action_name": "gmail.send",
  "token_snapshot": {
    "sub": "agent-demo-1",
    "scopes": ["email:send", "read"],
    "jti": "550e8400-e29b-41d4-a716-446655440000"
  },
  "timestamp": "2026-01-09T12:00:00",
  "input_hash": "a1b2c3d4e5f6789012345678901234567890abcdef1234567890abcdef123456",
  "policy_id": "770e8400-e29b-41d4-a716-446655440002",
  "result": "deny",
  "runtime_metadata": {},
  "public_key": "dGVzdC1wdWJsaWMta2V5LWJhc2U2NC1wbGFjZWhvbGRlcg==",
  "runtime_signature": "dGVzdC1zaWduYXR1cmUtYmFzZTY0LXBsYWNlaG9sZGVy"
}
